{
  "schema_version": "1.0",
  "doc_id": "doc-1",
  "dataset_id": "ds-1",
  "dataset_version": "v1",
  "index_version": "iv1",
  "source_id": "ManualImport",
  "source_object_ref_hash": "hash1",
  "object_version": "ov1",
  "section_path": "root",
  "chunk_index": 0,
  "chunk_id": "chunk-0",
  "content_hash": "chash",
  "extracted_text": "Sanitized technical content only.",
  "token_count": 10,
  "acl_ref": "acl-1",
  "provenance_ref": "prov-1",
  "scope_class": "architecture",
  "scope_confidence": 0.95,
  "scope_policy_fingerprint": "scopefp",
  "labels": [
    "IAM"
  ],
  "label_confidence": 1.0,
  "labeling_policy_fingerprint": "labelfp",
  "taxonomy_version": "1.0",
  "quality_score": 0.9,
  "quality_flags": [],
  "data_quality_policy_fingerprint": "qualfp",
  "sensitive_data_status": "pass",
  "sensitive_data_scan_summary_ref": "scan-1",
  "primary_detector_ruleset_id": "PRESIDIO_EU_PII_V1",
  "primary_detector_config_hash": "pdh",
  "secondary_detector_ruleset_id": "GITLEAKS_SECRETS_V1",
  "secondary_detector_config_hash": "sdh",
  "deletion_proof_ref": "delproof-1",
  "sanitized_destination_uri": "dest://sanitized/doc-1/chunk-0.jsonl",
  "index_destination": "index://main",
  "chunking_policy_fingerprint": "chunkfp",
  "extensions": {}
}